{
  "formatVersion": "0.1.0",
  "layout": {
    "entities": { "x": 40, "y": 139 },
    "byClass": { "x": 389, "y": 139 },
    "sorted": { "x": 738, "y": 139 },
    "rows": { "x": 1087, "y": 40 },
    "chartRows": { "x": 1087, "y": 238 },
    "answer": { "x": 1436, "y": 238 }
  },
  "structure": {
    "edges": [
      { "from": "entities.relation", "to": "byClass.input" },
      { "from": "byClass.relation", "to": "sorted.input" },
      { "from": "sorted.relation", "to": "rows.input" },
      { "from": "sorted.relation", "to": "chartRows.input" },
      { "from": "chartRows.table", "to": "answer.table" }
    ],
    "nodes": [
      { "id": "entities", "kind": "rel.table", "version": 1 },
      { "id": "byClass", "kind": "rel.aggregate", "version": 1 },
      { "id": "sorted", "kind": "rel.sort", "version": 1 },
      { "id": "rows", "kind": "rel.materialize", "version": 1 },
      { "id": "chartRows", "kind": "rel.materialize", "version": 1 },
      { "id": "answer", "kind": "chart.bar", "version": 1 }
    ]
  },
  "values": {
    "entities": { "source": "duplex-enriched", "table": "EntityText" },
    "byClass": { "groupBy": "Category", "aggregates": "count(*) as Count" },
    "sorted": { "by": "Count desc" },
    "rows": { "limit": "0" },
    "chartRows": { "limit": "15" },
    "answer": { "labelColumn": "Category", "valueColumns": "Count", "title": "Entities per IFC class, top 15", "sort": "desc" }
  }
}
