{
  "formatVersion": "0.1.0",
  "layout": {
    "about": {
      "x": 40,
      "y": 40,
      "w": 560,
      "h": 180
    },
    "entities": {
      "x": 40,
      "y": 264
    },
    "doors": {
      "x": 370,
      "y": 264
    },
    "doorWidths": {
      "x": 700,
      "y": 264
    },
    "widthMm": {
      "x": 1030,
      "y": 264
    },
    "columns": {
      "x": 1360,
      "y": 264
    },
    "byDoor": {
      "x": 1690,
      "y": 264
    },
    "rows": {
      "x": 2020,
      "y": 264
    },
    "answer": {
      "x": 2350,
      "y": 264
    },
    "coloured": {
      "x": 2680,
      "y": 264
    },
    "perVerdict": {
      "x": 3010,
      "y": 264
    },
    "chart": {
      "x": 3340,
      "y": 264
    },
    "parameters": {
      "x": 40,
      "y": 504
    },
    "overallWidth": {
      "x": 370,
      "y": 504
    },
    "model": {
      "x": 2350,
      "y": 504
    },
    "report": {
      "x": 2680,
      "y": 504
    }
  },
  "structure": {
    "edges": [
      {
        "from": "entities.relation",
        "to": "doors.input"
      },
      {
        "from": "parameters.relation",
        "to": "overallWidth.input"
      },
      {
        "from": "doors.relation",
        "to": "doorWidths.left"
      },
      {
        "from": "overallWidth.relation",
        "to": "doorWidths.right"
      },
      {
        "from": "doorWidths.relation",
        "to": "widthMm.input"
      },
      {
        "from": "widthMm.relation",
        "to": "columns.input"
      },
      {
        "from": "columns.relation",
        "to": "byDoor.input"
      },
      {
        "from": "byDoor.relation",
        "to": "rows.input"
      },
      {
        "from": "rows.table",
        "to": "answer.in"
      },
      {
        "from": "model.instances",
        "to": "coloured.instances"
      },
      {
        "from": "answer.out",
        "to": "coloured.values"
      },
      {
        "from": "answer.out",
        "to": "perVerdict.table"
      },
      {
        "from": "perVerdict.table",
        "to": "chart.table"
      },
      {
        "from": "answer.out",
        "to": "report.in"
      }
    ],
    "nodes": [
      {
        "id": "about",
        "kind": "view.note",
        "version": 1
      },
      {
        "id": "entities",
        "kind": "rel.table",
        "version": 1
      },
      {
        "id": "parameters",
        "kind": "rel.table",
        "version": 1
      },
      {
        "id": "doors",
        "kind": "rel.filter",
        "version": 1
      },
      {
        "id": "overallWidth",
        "kind": "rel.filter",
        "version": 1
      },
      {
        "id": "doorWidths",
        "kind": "rel.join",
        "version": 1
      },
      {
        "id": "widthMm",
        "kind": "rel.derive",
        "version": 1
      },
      {
        "id": "columns",
        "kind": "rel.select",
        "version": 1
      },
      {
        "id": "byDoor",
        "kind": "rel.sort",
        "version": 1
      },
      {
        "id": "rows",
        "kind": "rel.materialize",
        "version": 1
      },
      {
        "id": "answer",
        "kind": "check.rule",
        "version": 1
      },
      {
        "id": "model",
        "kind": "view3d.instances",
        "version": 1
      },
      {
        "id": "coloured",
        "kind": "view3d.color",
        "version": 1
      },
      {
        "id": "perVerdict",
        "kind": "table.aggregate",
        "version": 1
      },
      {
        "id": "chart",
        "kind": "chart.bar",
        "version": 1
      },
      {
        "id": "report",
        "kind": "sink.report",
        "version": 1
      }
    ]
  },
  "values": {
    "about": {
      "text": "Rule DC-W1 over the 14 doors of duplex-enriched: a door's Ifc:OverallWidth, in millimetres, must be at least 850 (NBC 2020 3.8.3.12, illustrative, not legal text); 8 pass and 6 fail. This is the check.rule twin of checking-analyses/check-ids-door-width, which states the same rule as an IDS file and gets the same verdicts. coloured paints the verdicts on the model, chart counts them, and report writes its HTML file only when you press Run."
    },
    "entities": {
      "source": "duplex-enriched",
      "table": "EntityText"
    },
    "parameters": {
      "source": "duplex-enriched",
      "table": "ParameterText"
    },
    "doors": {
      "expr": "[Category] == 'IFCDOOR'"
    },
    "overallWidth": {
      "expr": "[Name] == 'Ifc:OverallWidth'"
    },
    "doorWidths": {
      "leftKey": "EntityIndex",
      "rightKey": "EntityIndex",
      "kind": "inner"
    },
    "widthMm": {
      "name": "Width_mm",
      "expr": "toNumber([Value]) * 1000"
    },
    "columns": {
      "columns": "Name, Width_mm, GlobalId"
    },
    "byDoor": {
      "by": "GlobalId"
    },
    "rows": {
      "limit": "0"
    },
    "answer": {
      "checkId": "DC-W1",
      "title": "Door leaf width at least 850 mm",
      "citation": "NBC 2020 3.8.3.12 (illustrative, not legal text)",
      "expr": "[Width_mm] >= 850",
      "reviewExpr": ""
    },
    "model": {
      "path": "{SAMPLES}/duplex-enriched.ifc"
    },
    "coloured": {
      "joinColumn": "GlobalId",
      "valueColumn": "Verdict",
      "colorMap": "category10"
    },
    "perVerdict": {
      "groupBy": "Verdict",
      "aggregates": "count(*) as Doors"
    },
    "chart": {
      "labelColumn": "Verdict",
      "valueColumns": "Doors",
      "title": "DC-W1 door width verdicts",
      "sort": "desc"
    },
    "report": {
      "path": "{SAMPLES}/../../artifacts/nrc/dc-w1-verdicts.html",
      "title": "DC-W1 door width verdicts"
    }
  }
}
