{
  "formatVersion": "0.1.0",
  "layout": {
    "carbon": {
      "x": 40,
      "y": 40
    },
    "doors": {
      "x": 40,
      "y": 300
    }
  },
  "structure": {
    "edges": [],
    "nodes": [
      {
        "id": "carbon",
        "kind": "ids.specifications",
        "version": 1
      },
      {
        "id": "doors",
        "kind": "ids.specifications",
        "version": 1
      }
    ]
  },
  "values": {
    "carbon": {
      "ids": "{SAMPLES}/ids/nrc-analytics.ids"
    },
    "doors": {
      "ids": "{SAMPLES}/ids/dc-w1.ids"
    }
  }
}
