{
  "formatVersion": "0.1.0",
  "layout": {
    "about": {
      "x": 40,
      "y": 40,
      "w": 560,
      "h": 140
    },
    "storeys": {
      "x": 40,
      "y": 280
    },
    "entities": {
      "x": 40,
      "y": 520
    },
    "elements": {
      "x": 40,
      "y": 760
    },
    "placed": {
      "x": 370,
      "y": 280
    },
    "withGlobalId": {
      "x": 700,
      "y": 280
    },
    "analysed": {
      "x": 1030,
      "y": 280
    },
    "perStorey": {
      "x": 1360,
      "y": 280
    },
    "answer": {
      "x": 1690,
      "y": 280
    }
  },
  "structure": {
    "edges": [
      {
        "from": "storeys.relation",
        "to": "placed.t1"
      },
      {
        "from": "placed.relation",
        "to": "withGlobalId.left"
      },
      {
        "from": "entities.relation",
        "to": "withGlobalId.right"
      },
      {
        "from": "withGlobalId.relation",
        "to": "analysed.left"
      },
      {
        "from": "elements.relation",
        "to": "analysed.right"
      },
      {
        "from": "analysed.relation",
        "to": "perStorey.input"
      },
      {
        "from": "perStorey.relation",
        "to": "answer.input"
      }
    ],
    "nodes": [
      {
        "id": "about",
        "kind": "view.note",
        "version": 1
      },
      {
        "id": "storeys",
        "kind": "rel.table",
        "version": 1
      },
      {
        "id": "entities",
        "kind": "rel.table",
        "version": 1
      },
      {
        "id": "elements",
        "kind": "rel.csv",
        "version": 1
      },
      {
        "id": "placed",
        "kind": "rel.sql",
        "version": 1
      },
      {
        "id": "withGlobalId",
        "kind": "rel.join",
        "version": 1
      },
      {
        "id": "analysed",
        "kind": "rel.join",
        "version": 1
      },
      {
        "id": "perStorey",
        "kind": "rel.aggregate",
        "version": 1
      },
      {
        "id": "answer",
        "kind": "rel.sort",
        "version": 1
      }
    ]
  },
  "values": {
    "about": {
      "text": "Figure 10: the storey of every analysed element, read from the model instead of the CSV's Storey column. StoreyOfElement walks ContainedIn, PartOf and MemberOf; placed keeps each element's row with the smallest Depth, the pick nrc-rollup applies, so no element counts twice. Expected: 103, 93, 14 and 8 elements (nrc_analytics_storeys.csv)."
    },
    "storeys": {
      "source": "duplex-enriched",
      "table": "StoreyOfElement"
    },
    "entities": {
      "source": "duplex-enriched",
      "table": "EntityText"
    },
    "elements": {
      "source": "nrc",
      "path": "nrc_analytics_elements.csv"
    },
    "placed": {
      "sql": "SELECT EntityIndex, StoreyName\nFROM t1\nQUALIFY row_number() OVER (PARTITION BY EntityIndex ORDER BY Depth, StoreyIndex) = 1"
    },
    "withGlobalId": {
      "leftKey": "EntityIndex",
      "rightKey": "EntityIndex",
      "kind": "inner"
    },
    "analysed": {
      "leftKey": "GlobalId",
      "rightKey": "GlobalId",
      "kind": "inner"
    },
    "perStorey": {
      "groupBy": "StoreyName",
      "aggregates": "count(*) as Elements, sum(EmbodiedCarbon_A1A3_kgCO2e) as EmbodiedCarbon_A1A3_kgCO2e"
    },
    "answer": {
      "by": "EmbodiedCarbon_A1A3_kgCO2e desc"
    }
  }
}
