{
  "formatVersion": "0.1.0",
  "layout": {
    "about": {
      "x": 40,
      "y": 40,
      "w": 560,
      "h": 266
    },
    "orient": {
      "x": 385,
      "y": 866,
      "w": 310
    },
    "joined": {
      "x": 784,
      "y": 1024
    },
    "facade": {
      "x": 1133,
      "y": 1024,
      "w": 310
    },
    "kind": {
      "x": 1532,
      "y": 1024,
      "w": 310
    },
    "byDir": {
      "x": 1931,
      "y": 1068
    },
    "framed": {
      "x": 2325,
      "y": 639
    },
    "total": {
      "x": 2674,
      "y": 639,
      "w": 310
    },
    "sorted": {
      "x": 3073,
      "y": 639
    },
    "answer": {
      "x": 3422,
      "y": 873,
      "w": 310
    },
    "database": {
      "x": 40,
      "y": 1242
    },
    "attrs": {
      "x": 385,
      "y": 1206,
      "w": 310
    },
    "compass": {
      "x": 1926,
      "y": 776,
      "w": 310
    },
    "chart": {
      "x": 3422,
      "y": 405,
      "w": 310
    },
    "inst": {
      "x": 1926,
      "y": 1428
    },
    "scale": {
      "x": 1931,
      "y": 346
    },
    "keyed": {
      "x": 1931,
      "y": 1658
    },
    "colored": {
      "x": 2325,
      "y": 1190
    }
  },
  "structure": {
    "edges": [
      {
        "from": "orient.table",
        "to": "joined.a"
      },
      {
        "from": "attrs.table",
        "to": "joined.b"
      },
      {
        "from": "joined.table",
        "to": "facade.table"
      },
      {
        "from": "facade.table",
        "to": "kind.table"
      },
      {
        "from": "kind.table",
        "to": "byDir.table"
      },
      {
        "from": "compass.table",
        "to": "framed.a"
      },
      {
        "from": "byDir.table",
        "to": "framed.b"
      },
      {
        "from": "framed.table",
        "to": "total.table"
      },
      {
        "from": "total.table",
        "to": "sorted.table"
      },
      {
        "from": "kind.table",
        "to": "scale.values"
      },
      {
        "from": "sorted.table",
        "to": "chart.table"
      },
      {
        "from": "scale.legend",
        "to": "chart.scale"
      },
      {
        "from": "kind.table",
        "to": "keyed.table"
      },
      {
        "from": "inst.instances",
        "to": "colored.instances"
      },
      {
        "from": "keyed.table",
        "to": "colored.values"
      },
      {
        "from": "scale.legend",
        "to": "colored.scale"
      },
      {
        "from": "database.source",
        "to": "attrs.path"
      },
      {
        "from": "sorted.table",
        "to": "answer.table"
      }
    ],
    "nodes": [
      {
        "id": "about",
        "kind": "view.note",
        "version": 1
      },
      {
        "id": "orient",
        "kind": "bim.orientation",
        "version": 1
      },
      {
        "id": "database",
        "kind": "duck.source",
        "version": 1
      },
      {
        "id": "attrs",
        "kind": "duck.query",
        "version": 1
      },
      {
        "id": "joined",
        "kind": "table.join",
        "version": 1
      },
      {
        "id": "facade",
        "kind": "table.filter",
        "version": 1
      },
      {
        "id": "kind",
        "kind": "table.derive",
        "version": 1
      },
      {
        "id": "byDir",
        "kind": "table.pivot",
        "version": 1
      },
      {
        "id": "compass",
        "kind": "table.inline",
        "version": 1
      },
      {
        "id": "framed",
        "kind": "table.join",
        "version": 1
      },
      {
        "id": "total",
        "kind": "table.derive",
        "version": 1
      },
      {
        "id": "sorted",
        "kind": "table.sort",
        "version": 1
      },
      {
        "id": "scale",
        "kind": "view.colormap",
        "version": 1
      },
      {
        "id": "chart",
        "kind": "chart.bar",
        "version": 1
      },
      {
        "id": "keyed",
        "kind": "table.rename",
        "version": 1
      },
      {
        "id": "inst",
        "kind": "view3d.instances",
        "version": 1
      },
      {
        "id": "colored",
        "kind": "view3d.color",
        "version": 1
      },
      {
        "id": "answer",
        "kind": "view.table",
        "version": 1
      }
    ]
  },
  "values": {
    "orient": {
      "path": "{SAMPLES}/duplex-enriched.bos",
      "categories": "IFCWALL,IFCWALLSTANDARDCASE,IFCWINDOW"
    },
    "attrs": {
      "sql": "SELECT e.GlobalId, s.StoreyName AS Storey, p.Value = '.T.' AS IsExternal FROM EntityText e LEFT JOIN StoreyOfElement s ON s.EntityIndex = e.EntityIndex AND s.Depth = 1 LEFT JOIN ParameterText p ON p.EntityIndex = e.EntityIndex AND p.Name = 'IsExternal' WHERE e.Category IN ('IFCWALL', 'IFCWALLSTANDARDCASE', 'IFCWINDOW')"
    },
    "joined": {
      "aKey": "GlobalId",
      "mode": "inner"
    },
    "facade": {
      "expr": "IsExternal and Storey != 'T/FDN' and not contains(Name, 'Party Wall')"
    },
    "kind": {
      "name": "Element",
      "expr": "Category == 'IFCWINDOW' ? 'Window' : 'Wall'"
    },
    "byDir": {
      "groupBy": "Direction",
      "nameColumn": "Element",
      "valueColumn": "FacingArea",
      "aggregate": "sum"
    },
    "compass": {
      "rows": "[{\"Sector\":0,\"Direction\":\"N\"},{\"Sector\":1,\"Direction\":\"NE\"},{\"Sector\":2,\"Direction\":\"E\"},{\"Sector\":3,\"Direction\":\"SE\"},{\"Sector\":4,\"Direction\":\"S\"},{\"Sector\":5,\"Direction\":\"SW\"},{\"Sector\":6,\"Direction\":\"W\"},{\"Sector\":7,\"Direction\":\"NW\"}]"
    },
    "framed": {
      "aKey": "Direction",
      "mode": "left"
    },
    "total": {
      "name": "Total",
      "expr": "coalesce(Wall, 0) + coalesce(Window, 0)"
    },
    "sorted": {
      "A": "Sector"
    },
    "scale": {
      "valueColumn": "Direction",
      "colorMap": "category10"
    },
    "chart": {
      "labelColumn": "Direction",
      "valueColumns": "Wall,Window",
      "title": "Duplex facade area by compass direction (m2, project north)"
    },
    "keyed": {
      "renames": "GlobalId=globalId"
    },
    "inst": {
      "path": "{SAMPLES}/duplex-base.ifc"
    },
    "colored": {
      "joinColumn": "globalId",
      "valueColumn": "Direction",
      "colorMap": "category10"
    },
    "about": {
      "text": "Facade engineer: how much wall and glazing sits on each side of the building? bim.orientation puts every wall and window in one of eight compass sectors by the bearing from the plan centre to its box centre, from project north (+Y; the model carries no true north), and gives its face area as the larger vertical face of its box (length x height). The facade is the elements flagged IsExternal, less the party wall and the T/FDN foundation walls, which the source also flags. The bars are m2 of wall and window per sector; the 3D view colours each facade element by its sector on the same scale and leaves the rest grey. A sector is a position around the plan, not the way a face looks: windows near the ends of a long east wall land in NE or SE (viz-window-to-wall-ratio groups by facing). The polar spec draws each sector as a wedge whose radius is the total area."
    },
    "database": {
      "path": "{SAMPLES}/duplex-enriched.duckdb"
    },
    "answer": {
      "title": "Facade area by compass direction (m2)",
      "columns": "Direction,Wall,Window,Total"
    }
  }
}
