{
  "formatVersion": "0.1.0",
  "layout": {
    "elements": {
      "x": 40,
      "y": 270
    },
    "columns": {
      "x": 389,
      "y": 270
    },
    "ranked": {
      "x": 969,
      "y": 270
    },
    "top": {
      "x": 1464,
      "y": 270
    },
    "materialized": {
      "x": 1813,
      "y": 270
    },
    "renamed": {
      "x": 2162,
      "y": 270
    },
    "model": {
      "x": 2158,
      "y": 40
    },
    "ghosted": {
      "x": 2511,
      "y": 143
    }
  },
  "structure": {
    "edges": [
      {
        "from": "elements.relation",
        "to": "columns.input"
      },
      {
        "from": "columns.relation",
        "to": "ranked.input"
      },
      {
        "from": "ranked.relation",
        "to": "top.input"
      },
      {
        "from": "top.relation",
        "to": "materialized.input"
      },
      {
        "from": "materialized.table",
        "to": "renamed.table"
      },
      {
        "from": "model.instances",
        "to": "ghosted.instances"
      },
      {
        "from": "renamed.table",
        "to": "ghosted.ids"
      }
    ],
    "nodes": [
      {
        "id": "elements",
        "kind": "rel.csv",
        "version": 1
      },
      {
        "id": "columns",
        "kind": "rel.select",
        "version": 1
      },
      {
        "id": "ranked",
        "kind": "rel.sort",
        "version": 1
      },
      {
        "id": "top",
        "kind": "rel.limit",
        "version": 1
      },
      {
        "id": "materialized",
        "kind": "rel.materialize",
        "version": 1
      },
      {
        "id": "renamed",
        "kind": "table.rename",
        "version": 1
      },
      {
        "id": "model",
        "kind": "view3d.instances",
        "version": 1
      },
      {
        "id": "ghosted",
        "kind": "view3d.opacity",
        "version": 1
      }
    ]
  },
  "values": {
    "elements": {
      "path": "nrc_analytics_elements.csv",
      "source": "nrc"
    },
    "columns": {
      "columns": "GlobalId, Name, Category, OperationalCarbon_kgCO2e_per_year"
    },
    "ranked": {
      "by": "OperationalCarbon_kgCO2e_per_year desc, GlobalId"
    },
    "top": {
      "count": "10"
    },
    "materialized": {},
    "renamed": {
      "renames": "GlobalId=globalId"
    },
    "model": {
      "path": "samples/nrc/duplex-enriched.ifc"
    },
    "ghosted": {
      "alpha": "0.15",
      "joinColumn": "globalId",
      "scope": "others"
    }
  }
}